{"$schema":"https://json-schema.org/draft/2020-12/schema","$id":"urn:harness:experiment.v1","type":"object","additionalProperties":false,"required":["schema","experiment_id","candidate_id","champion_bundle_id","challenger_bundle_id","runtime_policy_digest","stages","hard_gates","state","sha256","candidate_receipt","champion_bundle_receipt","challenger_bundle_receipt"],"properties":{"schema":{"const":"harness.experiment.v1"},"experiment_id":{"$ref":"#/$defs/id"},"candidate_id":{"$ref":"#/$defs/id"},"champion_bundle_id":{"$ref":"#/$defs/id"},"challenger_bundle_id":{"$ref":"#/$defs/id"},"runtime_policy_digest":{"$ref":"#/$defs/digest"},"stages":{"type":"array","minItems":4,"maxItems":4,"prefixItems":[{"$ref":"#/$defs/offline"},{"$ref":"#/$defs/holdout"},{"$ref":"#/$defs/shadow"},{"$ref":"#/$defs/canary"}],"items":false},"hard_gates":{"type":"array","minItems":1,"items":{"type":"object","additionalProperties":false,"required":["gate_id","passed","evidence"],"properties":{"gate_id":{"$ref":"#/$defs/id"},"passed":{"type":"boolean"},"evidence":{"$ref":"#/$defs/hard_gate"}}}},"state":{"enum":["proposed","offline_running","holdout_running","shadow_running","canary_running","promotion_review","failed","inconclusive","invalidated","stopped"]},"sha256":{"$ref":"#/$defs/digest"},"candidate_receipt":{"$ref":"#/$defs/candidate_receipt"},"champion_bundle_receipt":{"$ref":"#/$defs/champion_receipt"},"challenger_bundle_receipt":{"$ref":"#/$defs/challenger_receipt"}},"allOf":[{"oneOf":[{"properties":{"state":{"const":"proposed"},"stages":{"$ref":"#/$defs/proposed"}}},{"properties":{"state":{"const":"offline_running"},"stages":{"$ref":"#/$defs/offline_running"}}},{"properties":{"state":{"const":"holdout_running"},"stages":{"$ref":"#/$defs/holdout_running"}}},{"properties":{"state":{"const":"shadow_running"},"stages":{"$ref":"#/$defs/shadow_running"}}},{"properties":{"state":{"const":"canary_running"},"stages":{"$ref":"#/$defs/canary_running"}}},{"properties":{"state":{"const":"promotion_review"},"stages":{"$ref":"#/$defs/promotion_review"}}},{"properties":{"state":{"const":"failed"},"stages":{"contains":{"properties":{"state":{"const":"failed"}}}}}},{"properties":{"state":{"const":"inconclusive"},"stages":{"contains":{"properties":{"state":{"enum":["inconclusive","infrastructure_unavailable"]}}}}}},{"properties":{"state":{"const":"invalidated"},"stages":{"contains":{"properties":{"state":{"const":"invalidated"}}}}}},{"properties":{"state":{"const":"stopped"},"stages":{"contains":{"properties":{"state":{"const":"stopped"}}}}}}]}],"$defs":{"id":{"type":"string","pattern":"^[A-Za-z0-9_.:-]{1,128}$"},"digest":{"type":"string","pattern":"^[0-9a-f]{64}$"},"evidence":{"type":"object","additionalProperties":false,"required":["stage","id","digest"],"properties":{"stage":{"enum":["offline","holdout","shadow","canary"]},"id":{"$ref":"#/$defs/id"},"digest":{"$ref":"#/$defs/digest"}}},"hard_gate":{"type":"object","additionalProperties":false,"required":["kind","id","digest"],"properties":{"kind":{"const":"hard_gate"},"id":{"$ref":"#/$defs/id"},"digest":{"$ref":"#/$defs/digest"}}},"stage":{"type":"object","additionalProperties":false,"required":["stage","state","evidence","sample_count","successful_pairs"],"properties":{"stage":{"enum":["offline","holdout","shadow","canary"]},"state":{"enum":["pending","running","passed","failed","inconclusive","infrastructure_unavailable","invalidated","stopped"]},"evidence":{"anyOf":[{"$ref":"#/$defs/evidence"},{"type":"null"}]},"sample_count":{"type":"integer","minimum":0},"successful_pairs":{"type":"integer","minimum":0}},"allOf":[{"if":{"properties":{"state":{"const":"passed"}},"required":["state"]},"then":{"properties":{"evidence":{"$ref":"#/$defs/evidence"}}}}]},"offline":{"allOf":[{"$ref":"#/$defs/stage"},{"properties":{"stage":{"const":"offline"},"evidence":{"anyOf":[{"type":"null"},{"allOf":[{"$ref":"#/$defs/evidence"},{"properties":{"stage":{"const":"offline"}}}]}]}}}]},"holdout":{"allOf":[{"$ref":"#/$defs/stage"},{"properties":{"stage":{"const":"holdout"},"evidence":{"anyOf":[{"type":"null"},{"allOf":[{"$ref":"#/$defs/evidence"},{"properties":{"stage":{"const":"holdout"}}}]}]}}}]},"shadow":{"allOf":[{"$ref":"#/$defs/stage"},{"properties":{"stage":{"const":"shadow"},"evidence":{"anyOf":[{"type":"null"},{"allOf":[{"$ref":"#/$defs/evidence"},{"properties":{"stage":{"const":"shadow"}}}]}]}}}]},"canary":{"allOf":[{"$ref":"#/$defs/stage"},{"properties":{"stage":{"const":"canary"},"evidence":{"anyOf":[{"type":"null"},{"allOf":[{"$ref":"#/$defs/evidence"},{"properties":{"stage":{"const":"canary"}}}]}]}}}]},"vector":{"type":"array","minItems":4,"maxItems":4},"proposed":{"allOf":[{"$ref":"#/$defs/vector"},{"prefixItems":[{"properties":{"state":{"const":"pending"}}},{"properties":{"state":{"const":"pending"}}},{"properties":{"state":{"const":"pending"}}},{"properties":{"state":{"const":"pending"}}}]}]},"offline_running":{"allOf":[{"$ref":"#/$defs/vector"},{"prefixItems":[{"properties":{"state":{"const":"running"}}},{"properties":{"state":{"const":"pending"}}},{"properties":{"state":{"const":"pending"}}},{"properties":{"state":{"const":"pending"}}}]}]},"holdout_running":{"allOf":[{"$ref":"#/$defs/vector"},{"prefixItems":[{"properties":{"state":{"const":"passed"}}},{"properties":{"state":{"const":"running"}}},{"properties":{"state":{"const":"pending"}}},{"properties":{"state":{"const":"pending"}}}]}]},"shadow_running":{"allOf":[{"$ref":"#/$defs/vector"},{"prefixItems":[{"properties":{"state":{"const":"passed"}}},{"properties":{"state":{"const":"passed"}}},{"properties":{"state":{"const":"running"}}},{"properties":{"state":{"const":"pending"}}}]}]},"canary_running":{"allOf":[{"$ref":"#/$defs/vector"},{"prefixItems":[{"properties":{"state":{"const":"passed"}}},{"properties":{"state":{"const":"passed"}}},{"properties":{"state":{"const":"passed"}}},{"properties":{"state":{"const":"running"}}}]}]},"promotion_review":{"allOf":[{"$ref":"#/$defs/vector"},{"prefixItems":[{"properties":{"state":{"const":"passed"}}},{"properties":{"state":{"const":"passed"}}},{"properties":{"state":{"const":"passed"}}},{"properties":{"state":{"const":"passed"}}}]}]},"artifact_receipt":{"type":"object","additionalProperties":false,"required":["kind","id","digest"],"properties":{"kind":{"enum":["candidate","champion_bundle","challenger_bundle"]},"id":{"$ref":"#/$defs/id"},"digest":{"$ref":"#/$defs/digest"}}},"candidate_receipt":{"allOf":[{"$ref":"#/$defs/artifact_receipt"},{"properties":{"kind":{"const":"candidate"}}}]},"champion_receipt":{"allOf":[{"$ref":"#/$defs/artifact_receipt"},{"properties":{"kind":{"const":"champion_bundle"}}}]},"challenger_receipt":{"allOf":[{"$ref":"#/$defs/artifact_receipt"},{"properties":{"kind":{"const":"challenger_bundle"}}}]}}}
