{"schema":"harness.experiment.v1","experiment_id":"experiment-1","candidate_id":"candidate-1","champion_bundle_id":"champion-1","challenger_bundle_id":"challenger-1","runtime_policy_digest":"aaaaaaaaaaaaaaaaaaaaaaaaaaaaaaaaaaaaaaaaaaaaaaaaaaaaaaaaaaaaaaaa","stages":[{"stage":"offline","state":"passed","evidence":{"stage":"offline","id":"receipt-offline","digest":"aaaaaaaaaaaaaaaaaaaaaaaaaaaaaaaaaaaaaaaaaaaaaaaaaaaaaaaaaaaaaaaa"},"sample_count":20,"successful_pairs":20},{"stage":"holdout","state":"passed","evidence":{"stage":"holdout","id":"receipt-holdout","digest":"aaaaaaaaaaaaaaaaaaaaaaaaaaaaaaaaaaaaaaaaaaaaaaaaaaaaaaaaaaaaaaaa"},"sample_count":20,"successful_pairs":20},{"stage":"shadow","state":"passed","evidence":{"stage":"shadow","id":"receipt-shadow","digest":"aaaaaaaaaaaaaaaaaaaaaaaaaaaaaaaaaaaaaaaaaaaaaaaaaaaaaaaaaaaaaaaa"},"sample_count":20,"successful_pairs":20},{"stage":"canary","state":"running","evidence":null,"sample_count":0,"successful_pairs":0}],"hard_gates":[{"gate_id":"gate-1","passed":true,"evidence":{"kind":"hard_gate","id":"receipt-gate","digest":"aaaaaaaaaaaaaaaaaaaaaaaaaaaaaaaaaaaaaaaaaaaaaaaaaaaaaaaaaaaaaaaa"}}],"state":"canary_running","sha256":"d3fe40f55ea3551d30166559872767e16c447213b4aabcba7a34381322a75590","candidate_receipt":{"kind":"candidate","id":"candidate-1","digest":"aaaaaaaaaaaaaaaaaaaaaaaaaaaaaaaaaaaaaaaaaaaaaaaaaaaaaaaaaaaaaaaa"},"champion_bundle_receipt":{"kind":"champion_bundle","id":"champion-1","digest":"aaaaaaaaaaaaaaaaaaaaaaaaaaaaaaaaaaaaaaaaaaaaaaaaaaaaaaaaaaaaaaaa"},"challenger_bundle_receipt":{"kind":"challenger_bundle","id":"challenger-1","digest":"aaaaaaaaaaaaaaaaaaaaaaaaaaaaaaaaaaaaaaaaaaaaaaaaaaaaaaaaaaaaaaaa"}}
